{
  "$schema": "http://json-schema.org/draft-07/schema#",
  "$id": "https://github.com/limbpuma/qa-gate/schemas/config.schema.json",
  "title": "qa-gate repository configuration (qa-gate.config.json)",
  "description": "Deep-merged over templates/qa-gate.config.json. Only what differs from the template needs to be here. Guarded by the gate-config check: a change on a branch is FAIL until reviewed.",
  "type": "object",
  "properties": {
    "$schema": {
      "type": "string"
    },
    "version": {
      "type": "integer",
      "const": 1
    },
    "gateVersion": {
      "type": "string",
      "pattern": "^\\d+\\.\\d+\\.\\d+$",
      "description": "Gate version this repo expects; written by init, moved by `qa-gate.sh update`."
    },
    "profile": {
      "type": "string",
      "enum": [
        "auto",
        "sandbox",
        "portfolio-demo",
        "mvp-client",
        "production"
      ],
      "description": "auto = DEPLOY_PROFILE from .env, infra/.env or deploy/.env, else portfolio-demo."
    },
    "profiles": {
      "type": "object",
      "additionalProperties": {
        "type": "object",
        "properties": {
          "skip": {
            "type": "array",
            "items": {
              "type": "string"
            },
            "description": "Check ids or stage names this profile does not run (recorded as SKIP with the reason)."
          },
          "lighthouse": {
            "$ref": "#/definitions/lighthouse"
          },
          "sitemapMaxPages": {
            "type": "integer",
            "minimum": 0
          },
          "commitHistory": {
            "type": "boolean"
          }
        }
      }
    },
    "stack": {
      "oneOf": [
        {
          "type": "string",
          "enum": [
            "auto",
            "node",
            "go",
            "python"
          ]
        },
        {
          "type": "array",
          "items": {
            "type": "string",
            "enum": [
              "node",
              "go",
              "python"
            ]
          }
        }
      ]
    },
    "git": {
      "type": "object",
      "properties": {
        "base": {
          "type": "string",
          "description": "Base branch for gate-config and the secrets diff; auto = main, else master."
        }
      }
    },
    "commands": {
      "type": "object",
      "properties": {
        "node": {
          "type": "object",
          "additionalProperties": {
            "type": "string"
          },
          "description": "auto = package.json script of the same name, else a pnpm workspace script."
        },
        "go": {
          "type": "object",
          "additionalProperties": {
            "type": "string"
          }
        },
        "python": {
          "type": "object",
          "properties": {
            "lint": {
              "type": "string"
            },
            "unit": {
              "type": "string"
            },
            "env": {
              "type": "object",
              "additionalProperties": {
                "type": "string"
              }
            }
          }
        }
      }
    },
    "coverage": {
      "type": "object",
      "properties": {
        "min": {
          "type": "number",
          "minimum": 0,
          "maximum": 100
        },
        "ratchet": {
          "type": "boolean",
          "description": "Coverage may never drop below the last committed value minus tolerance."
        },
        "ratchetFile": {
          "type": "string"
        },
        "tolerance": {
          "type": "number",
          "minimum": 0
        }
      }
    },
    "secrets": {
      "type": "object",
      "properties": {
        "excludes": {
          "type": "array",
          "items": {
            "type": "string"
          }
        }
      }
    },
    "waivers": {
      "type": "array",
      "description": "Accepted risks with an expiry: that check's FAIL becomes WARN until the date. `by` is required from mvp-client, `reason` in production.",
      "items": {
        "type": "object",
        "required": [
          "check",
          "until"
        ],
        "additionalProperties": false,
        "properties": {
          "check": {
            "type": "string",
            "description": "A check id (trivy-fs, coverage, audit …) or a legal rule id (vsbg.odr-link …)."
          },
          "until": {
            "type": "string",
            "pattern": "^\\d{4}-\\d{2}-\\d{2}$"
          },
          "reason": {
            "type": "string"
          },
          "by": {
            "type": "string",
            "description": "The person who accepted the risk."
          }
        }
      }
    },
    "semgrep": {
      "type": "object",
      "properties": {
        "image": {
          "type": "string"
        },
        "rulesets": {
          "type": "array",
          "items": {
            "type": "string"
          }
        },
        "stackRulesets": {
          "type": "object"
        },
        "blockOn": {
          "type": "string",
          "enum": [
            "ERROR",
            "WARNING"
          ]
        },
        "changedOnly": {
          "type": "boolean"
        }
      }
    },
    "trivy": {
      "type": "object",
      "properties": {
        "image": {
          "type": "string"
        },
        "severity": {
          "type": "string"
        },
        "ignoreUnfixed": {
          "type": "boolean"
        },
        "scanners": {
          "type": "string"
        },
        "timeoutMin": {
          "type": "integer"
        },
        "skipDirs": {
          "type": "array",
          "items": {
            "type": "string"
          }
        }
      }
    },
    "audit": {
      "type": "object",
      "properties": {
        "level": {
          "type": "string",
          "enum": [
            "low",
            "moderate",
            "high",
            "critical"
          ]
        }
      }
    },
    "build": {
      "type": "object",
      "properties": {
        "dockerfile": {
          "type": "string"
        },
        "context": {
          "type": "string"
        },
        "target": {
          "type": "string"
        }
      }
    },
    "web": {
      "type": "object",
      "properties": {
        "baseUrl": {
          "type": "string",
          "description": "Empty = staging and compliance are SKIP."
        },
        "paths": {
          "oneOf": [
            {
              "type": "array",
              "items": {
                "type": "string"
              }
            },
            {
              "type": "string",
              "const": "sitemap"
            }
          ],
          "description": "Pages to audit, or \"sitemap\" to read /sitemap.xml (capped per profile; legal pages always included)."
        },
        "sitemapMaxPages": {
          "type": "integer",
          "minimum": 1
        },
        "startCommand": {
          "type": "string"
        },
        "readyPath": {
          "type": "string"
        },
        "startTimeoutSec": {
          "type": "integer"
        },
        "lighthouse": {
          "$ref": "#/definitions/lighthouse"
        },
        "pa11y": {
          "type": "object",
          "properties": {
            "standard": {
              "type": "string"
            },
            "runners": {
              "type": "array",
              "items": {
                "type": "string"
              }
            }
          }
        },
        "axe": {
          "type": "object",
          "properties": {
            "tags": {
              "type": "array",
              "items": {
                "type": "string"
              }
            },
            "warnTags": {
              "type": "array",
              "items": {
                "type": "string"
              }
            },
            "blockImpacts": {
              "type": "array",
              "items": {
                "type": "string"
              }
            }
          }
        },
        "nuclei": {
          "type": "object",
          "properties": {
            "enabled": {
              "type": "boolean"
            },
            "image": {
              "type": "string"
            },
            "templates": {
              "type": "array",
              "items": {
                "type": "string"
              }
            },
            "severity": {
              "type": "string"
            }
          }
        }
      }
    },
    "legal": {
      "type": "object",
      "properties": {
        "impressumPath": {
          "type": "string"
        },
        "datenschutzPath": {
          "type": "string"
        },
        "barrierefreiheitPath": {
          "type": "string"
        },
        "agbPath": {
          "type": "string"
        },
        "widerrufPath": {
          "type": "string"
        },
        "checkoutPath": {
          "type": "string"
        },
        "sector": {
          "type": "string",
          "description": "Loads lib/web/legal/packs/<sector>.json; an unknown sector is FAIL."
        },
        "features": {
          "type": "array",
          "items": {
            "type": "string",
            "enum": [
              "shop",
              "food",
              "forms",
              "newsletter"
            ]
          },
          "description": "Business facts, decided by a human: shop = goods ordered and paid online (PAngV, Widerruf, Muster-Widerrufsformular); food = food ordered at a distance (LMIV Art. 14 allergens block); forms = forms collecting an e-mail; newsletter = newsletter sign-up. A menu-only landing page without ordering declares none of them."
        },
        "allowedHosts": {
          "type": "array",
          "items": {
            "type": "string"
          },
          "description": "First-party CDN hosts that are not third parties."
        },
        "consent": {
          "type": "object",
          "properties": {
            "required": {
              "type": "boolean"
            },
            "acceptText": {
              "type": "string"
            },
            "rejectText": {
              "type": "string"
            },
            "settingsText": {
              "type": "string"
            }
          }
        },
        "impressum": {
          "type": "object",
          "properties": {
            "requiredPatterns": {
              "type": "array",
              "items": {
                "type": "string"
              }
            }
          }
        },
        "ai": {
          "type": "object",
          "properties": {
            "enabled": {
              "oneOf": [
                {
                  "type": "boolean"
                },
                {
                  "type": "string",
                  "const": "auto"
                }
              ]
            },
            "chatSelector": {
              "type": "string"
            },
            "disclosureText": {
              "type": "string"
            },
            "providers": {
              "type": "array",
              "items": {
                "type": "string"
              }
            },
            "registerPath": {
              "type": "string"
            }
          }
        }
      }
    },
    "report": {
      "type": "object",
      "properties": {
        "dir": {
          "type": "string"
        },
        "keepLogs": {
          "type": "integer"
        },
        "history": {
          "type": "boolean"
        },
        "commitHistory": {
          "type": "boolean"
        },
        "autoUi": {
          "type": "boolean",
          "description": "Start the report page in the background before a stage runs (never for pre-commit, never in CI). Same as --ui."
        },
        "uiIdleMinutes": {
          "type": "integer",
          "minimum": 0,
          "description": "The page stops itself after this many minutes without a request; 0 = never."
        }
      }
    },
    "spec": {
      "type": "object",
      "description": "Where the business facts block (```qa-gate fence) is looked for and when it counts as stale.",
      "properties": {
        "files": {
          "type": "array",
          "items": {
            "type": "string"
          },
          "description": "Files or directories (walked 3 levels) searched for the block; deprecated blocks are ignored, the most recently touched wins."
        },
        "codePaths": {
          "type": "array",
          "items": {
            "type": "string"
          },
          "description": "Paths whose commits count as code changes since the spec was last touched."
        },
        "staleAfterDays": {
          "type": "integer",
          "minimum": 1
        },
        "staleAfterCommits": {
          "type": "integer",
          "minimum": 1
        }
      }
    },
    "deploy": {
      "type": "object",
      "description": "The deploy stage verifies a site AFTER it was deployed; it never deploys.",
      "properties": {
        "liveUrl": {
          "type": "string",
          "description": "https URL of the live site (or pass --base-url)."
        },
        "smokeTimeoutSec": {
          "type": "integer",
          "minimum": 1
        }
      }
    },
    "ai": {
      "type": "object",
      "description": "How this repo's own AI code is checked. Distinct from legal.ai, which is what the website tells its visitors (KI-VO Art. 50).",
      "properties": {
        "manifestFile": {
          "type": "string",
          "description": "Committed pin of every eval case's id+category (default qa-report/ai-eval-manifest.json). Guarded by gate-config: re-tagging a safety case is a base-branch decision, never a quiet edit. Write it with qa-gate.sh ai-manifest."
        },
        "promptGlobs": {
          "type": "array",
          "items": {
            "type": "string"
          },
          "description": "Git pathspec globs for the prompt files; evidence older than the newest commit touching them is stale."
        },
        "evalFile": {
          "type": "string",
          "description": "The evidence the project produces (schemas/ai-eval.schema.json)."
        },
        "ratchetFile": {
          "type": "string",
          "description": "Commit it: it holds the case ids that passed, so a regression is provable."
        }
      }
    }
  },
  "definitions": {
    "lighthouse": {
      "type": "object",
      "properties": {
        "runs": {
          "type": "integer",
          "minimum": 1
        },
        "formFactors": {
          "type": "array",
          "items": {
            "type": "string",
            "enum": [
              "mobile",
              "desktop"
            ]
          }
        },
        "thresholds": {
          "type": "object",
          "additionalProperties": {
            "type": "number",
            "minimum": 0,
            "maximum": 100
          }
        }
      }
    }
  }
}
